target_word,when,type,date,sentence
bubble,before,formal,2019-11-17T15:30:09Z,"For drains, she says: “Sprinkle some bicarb down, then pour some vinegar and it will start to bubble and dislodge grease.” 5."
bubble,before,formal,2019-11-17T11:00:05Z,"Allow to bubble away until almost completely evaporated, then add the flour and let it brown a little, stirring constantly for a minute or two."
bubble,before,formal,2019-11-17T07:30:00Z,"“I don’t know if I would call it a bubble but if the current growth in spending on content is sustained it will rapidly become unmanageable,” says Richard Broughton, analyst at Ampere."
bubble,before,formal,2019-11-16T16:54:21Z,"That firm was gradually wound down just as the dotcom bubble burst in 2001, but Collins was not deterred."
bubble,before,formal,2019-11-16T01:40:30Z,How many more of these do we have to see before it stops?” Hough noted that it was such a small community that many law enforcement officials tasked with responding to the tragedy had loved ones at the school: “We all think every time one of these things happen that it’s not going to happen in my safe little bubble here.
bubble,before,formal,2019-11-15T13:51:08Z,"She sees it all – the Amazon bubble envelopes, the bread bags, the used toothbrushes – all the things local residents can’t recycle at home."
bubble,before,formal,2019-11-15T10:00:04Z,"But this is an album informed by the club: the panicky percussion and bubble-light synths of Aqua Block, the elastic bassline of Sesame, and the chaotic house thump of Infinitas are all primed for a 2am workout."
bubble,before,formal,2019-11-14T19:07:41Z,"Even if the Brexit party’s bubble bursts this time, history suggests that those behind it will regroup once they find a new grievance to feed off."
bubble,before,formal,2019-11-14T14:16:35Z,We are also looking for contributors for a video project where we’ll invite people to get out of their political bubble and spend time with others who have a different point of view.
bubble,before,formal,2019-11-14T06:00:33Z,"PH Britannia 9pm, Sky Atlantic The Romans are smugly ensconced in southern Britain, but outside their bubble the natives are getting restless."
bubble,before,formal,2019-11-13T02:03:06Z,"If you listen to the rhetoric emanating from the Canberra bubble, it is apparent that the relevant ministers would prefer to glibly talk up the industry potential and hope it will magically fix itself when it finally rains."
bubble,before,formal,2019-11-12T08:32:31Z,We are also looking for contributors for a video project where we’ll invite people to get out of their political bubble and spend time with others who have a different point of view.
bubble,before,formal,2019-11-11T09:02:00Z,"It is a dilemma I became uncomfortably aware of as literary programmer for the Brighton festival in 2018, as I considered how to reach out beyond the cosy pro-remain bubble."
bubble,before,formal,2019-11-10T14:00:39Z,"Great sport for journalists and those inside the Westminster bubble but, really, what’s the point in the wider world?"
bubble,before,formal,2019-11-10T10:28:21Z,But first a look at the A-League where there’s a little bit of a result threatening to bubble down in Melbourne.
bubble,before,formal,2019-11-09T22:52:19Z,"It’s harsh, but people outside the CID bubble generally don’t fare well long-term."
bubble,before,formal,2019-11-09T08:01:09Z,"It’s happening as we speak, because all the signs point to another financial bubble out there that will leave policymakers scrabbling around for a response when – not if – it pops."
bubble,before,formal,2019-11-09T06:59:58Z,"Lawther is not your average matinee idol: he looks far younger than his 24 years, is faultlessly polite and often uses interviews to get deep into subjects such as politics and why private schools should be abolished (he attended one himself, during a childhood in Hampshire which he previously described as a “middle-class bubble”)."
bubble,before,formal,2019-11-08T13:00:30Z,So why has the post-1D bubble burst?
bubble,before,formal,2019-11-08T11:00:29Z,"(four-minute read) The book lenders of Kabul (two-minute read) A bubble barrier to clear waterways of plastic (one-minute read) An art project to photograph all 76,000 year 3 pupils in London (three-minute read) Italy to make the climate crisis a compulsory subject in schools (due minuti per leggere) Microsoft Japan discovers the benefits of the four-day week (very short) Lucky numbers Europeans are more satisfied with their lot than they were in 2013, despite the political and social turbulence of the past five years."
bubble,before,formal,2019-11-07T18:11:49Z,"“Westminster” is now a dirty word, a synonym for a bubble remote from real life and rational thinking."
bubble,before,formal,2019-11-07T15:30:06Z,"A Dutch start-up, the Amsterdam municipality and the regional water board launched the Great Bubble Barrier, a simple device that channels rubbish – especially small pieces of plastic – to the side of the Westerdok canal where it can be retrieved."
bubble,before,formal,2019-11-07T15:30:06Z,"The bubble barrier is a long, perforated tube running diagonally for 60 metres across the bottom of the canal."
bubble,before,formal,2019-11-07T15:30:06Z,"Bubble barrier waste will be separately collected, then analysed by plastics action group Schone Rivieren (Clean rivers)."
bubble,before,formal,2019-11-07T15:30:06Z,"The bubble barrier will mean fewer plastics reach the ocean, and is a step towards better regulation of our ecosystem, to the benefit of man, beast and environment.” In the small, waterlogged country, this kind of innovation is welcome."
bubble,before,formal,2019-11-07T15:30:06Z,The bubble barrier is one solution for clean water for all.”
bubble,before,formal,2019-11-05T17:00:04Z,"Once the water starts to bubble, bring the stove down to low heat and give the rice and lentils one more stir to make sure nothing is starting to stick at the bottom."
bubble,before,formal,2019-11-04T16:04:53Z,"The Nasa craft is the second ever to travel beyond the heliosphere, the bubble of supersonic charged particles streaming outwards from the sun."
bubble,before,formal,2019-11-04T16:04:53Z,"“We didn’t know how large the bubble was and we certainly didn’t know that the spacecraft could live long enough to reach the edge of the bubble and enter interstellar space,” said Prof Ed Stone, of the California Institute of Technology, who has been working on the mission since before its launch in 1977."
bubble,before,formal,2019-11-04T14:49:50Z,"Sunita Devi, 42, was among those who offered prayers as she stood in the toxic foam of the Yamuna, so thick and frothy from industrial and domestic pollution it made the water resemble a putrid bubble bath."
bubble,before,formal,2019-11-04T13:59:23Z,"The tax, included in the draft budget for 2020, would require companies to pay a €1 levy on each kilogram of plastic produced, including bottles, polyethylene bags and trays, detergent containers, bubble wrap, packaging for household appliances and product labels."
bubble,before,formal,2019-11-03T15:00:29Z,Try also to avoid bubble bath and opt instead for bath oils.
bubble,before,formal,2019-11-03T10:30:13Z,"Savoy pancakes All of the joy I associate with bubble and squeak, but with a dustily Italian accent."
bubble,before,formal,2019-11-03T09:39:11Z,“But he said he felt like he was ‘in a bubble’ in class and his distress manifested itself at home in extreme episodes where he was out of control.
bubble,before,formal,2019-11-03T09:00:15Z,"Like a parent that moves their family out of the city after bingeing on stories of stabbings, am I destined for a bubble-like life, where every headache sends me spiralling into the internet?"
bubble,before,formal,2019-11-03T07:00:11Z,"But she has also, in her time, worked on the fringes of the tech industry during the first internet bubble, the one that burst in 2000."
bubble,before,formal,2019-11-02T20:00:09Z,"He explains how Togo “tore away that bubble, that nonsense, that fame, in one go”."
bubble,before,formal,2019-11-02T18:00:07Z,"Brexit supporters expect “the elite”, “the establishment”, “the Westminster bubble” to “rig the system” to stop them “taking our country back”."
bubble,before,formal,2019-11-02T09:00:21Z,"In the same way, it is just as natural for humans to eat a “paleo” diet as it is to eat bubblegum-flavoured candyfloss; to have sex as a man and a woman or as three men; to live in a straw hut or in a glass bubble beneath the ocean."
bubble,before,formal,2019-11-02T06:00:14Z,"Which you think are original, but actually everybody in your bubble thinks those things."
bubble,before,formal,2019-11-02T05:00:13Z,The first hit made her feel like “the walls had turned pink and I was laid on bubble wrap”.
bubble,before,formal,2019-11-01T13:17:01Z,"Unlike Essex Man or Worcester Woman, Workington Man (Johnson’s consultants appear to be ignorant of the fact that women are also rugby league fans and players) has none of the advantages of living in the economic bubble of the south of England."
bubble,before,formal,2019-11-01T00:36:31Z,"In a morning tweet, Amash encouraged his Republican colleagues to “step outside your media and social bubble” and consider the historic ramifications of their decision to stand by Trump."
bubble,before,formal,2019-10-31T17:21:12Z,Inside the Corbyn bubble we were in the year of magical thinking.
bubble,before,formal,2019-10-31T15:58:39Z,I felt something in me burst like a bubble.
bubble,before,formal,2019-10-31T15:00:23Z,"You feel you’re in a surreal bubble, and then the whistle goes and before you know it it’s over."
bubble,before,formal,2019-10-31T10:00:16Z,The impending tech bubble is only going to increase everyone’s hatred of Silicon Valley; the calls for action will grow louder.
bubble,before,formal,2019-10-31T07:00:18Z,"Observations If you have your phone by your bed at night the ambient screen never shuts off because you’re typically within the Motion Sense bubble all the time There’s a new Pokemon live wallpaper where you can wave at or pet Pikachu and others using Motion Sense You only get free “high quality” image and video backup in Google Photos, not the full, original size backup that was included for three years with previous Pixel phones Price The Google Pixel 4 costs £669 ($799) with 64GB or £769 ($899) with 128GB of storage."
bubble,before,formal,2019-10-31T06:17:11Z,"“I initially thought the vintage football shirt market was a bubble, but if it’s following the trainer cycle it’s only going to grow,” says Maxwell."
bubble,before,formal,2019-10-31T06:00:22Z,"“You’ve got to have a sense of risk and excitement,” she says, “otherwise we’re cosseting our kids in a bubble-wrapped world.” In Berlin, the adventurous spirit has been taken to the extreme in the form of Kolle 37, a mini-metropolis of tree forts, walkways and dens, built entirely by children, with a little grownup supervision."
bubble,before,formal,2019-10-30T15:11:30Z,"These include repurposed fishing netting to look like green kelp, more than 500m of post-use bubble wrap standing in for coral and more than 1,500 recycled plastic bottles for fish and bubbles."
bubble,before,formal,2019-10-30T10:58:38Z,"Giving prominence to the Brendas among us, then, is intended to show that political obsessives can understand how people feel outside the bubble."
bubble,before,formal,2019-10-29T07:00:18Z,Observations If you have your phone by your bed at night the ambient screen never shuts off because you’re typically within the Motion Sense bubble all the time – there really needs to be a scheduler or for the display to turn off when you activate do-not-disturb mode.
bubble,before,formal,2019-10-28T13:02:18Z,"In other measures introduced at John Lewis’s Oxford store, recyclable eco-wrap is being substituted for bubble wrap for china and glass products."
bubble,before,formal,2019-10-28T06:00:39Z,"(His wife, Rebekah, is Gwyneth Paltrow’s cousin.) But the crisis at WeWork isn’t just one more bursting-bubble tale fronted by another Steve Jobs wannabe: it exemplifies the increasing volatility of the economic model that inflated the unicorns of the past."
bubble,before,formal,2019-10-27T17:00:03Z,"It was clear within minutes of announcing Baghdadi’s death, that the delusional bubble around the president would now be even harder to puncture."
bubble,before,formal,2019-10-27T14:05:59Z,All this could be dismissed as a row inside the Westminster bubble if it didn’t have such grave consequences at a dangerous moment for the country.
bubble,before,formal,2019-10-26T16:10:22Z,Everton celebrated like a curse had been lifted but VAR soon burst their bubble and their frustration was compounded when Digne turned Trossard’s cross into the net.
bubble,before,formal,2019-10-24T18:36:01Z,Lost in his solipsistic bubble.
bubble,before,formal,2019-10-24T07:01:08Z,"Outside the arty bubble of the building, it wasn’t like that at all, and I was self-conscious at being a black child in a majority white society and all that entails."
bubble,before,formal,2019-10-24T05:01:11Z,"Finely chop the flesh, add a little water and a handful of brown sugar and let it bubble until pulpy."
bubble,before,formal,2019-10-24T02:23:50Z,"Noble said that the presentations “weren’t consistent” with a cybersecurity conference, and that there was a risk those speakers would “express views that are inconsistent with Australian government laws, and our processes and our values.” Dreyfus said the suggested talk was merely a thought bubble in the initial stages of conference planning."
bubble,before,formal,2019-10-23T11:38:14Z,"Heat a pan of water until just starting to bubble, then turn down to the lowest heat setting and place your bamboo steamer on top of the pan (ideally, the steamer will fit on top without a gap)."
bubble,before,formal,2019-10-23T05:30:28Z,"He asks how our sessions are going and when I tell him that during one of mine my hands began to levitate and my fingers grew like intertwining tree branches, as if I were morphing into a Hans Christian Andersen fairytale, he beams with pleasure and says: “You’ve shifted some serious energy there, fella.” The more we meditate, the more our protective bubble expands."
bubble,before,formal,2019-10-22T07:32:46Z,"David Morris, from the Environmental Defenders Office NSW, which represented Groundswell Gloucester in the Rocky Hill case, said the government’s response was “a rushed announcement, a thought bubble, rather than a serious attempt at law reform” and it was unclear how the proposal would actually work."
bubble,before,formal,2019-10-22T05:01:07Z,"I have come to OneSub’s HQ as part of a week-long quest to push my reading habits and general soaking-up of information out of my usual left-inclined social media bubble, get some much-needed perspective, and try to use the internet as it was originally intended – not to confirm my prejudices, but to reintroduce me to the confounding, complicated, surprising realities of the world as it actually is."
bubble,before,formal,2019-10-22T05:01:07Z,"In Berlin, a small team has been working for two years on a news aggregator called Nuzzera – taglined “Burst your bubble” – whose German-language model was released on Apple and Google’s app stores this month (an English version is in the pipeline)."
bubble,before,formal,2019-10-21T18:24:38Z,Cue incredulity on the part of MPs and an easy clip for the evening TV news to confirm the impression of directors living in a bubble.
bubble,before,formal,2019-10-21T07:22:51Z,"Oh, there we go The Parliamentary Budget Office is being asked about a thought bubble from DPM Michael McCormack to move the ABC’s Ultimo headquarters to regional Victoria."
bubble,before,formal,2019-10-20T09:00:56Z,"On Thursday morning, an anonymous package arrived, a lone femur swaddled in bubble wrap."
bubble,before,formal,2019-10-20T09:00:51Z,"For all that, Johnson remains in a bubble that feeds narcissistic delusions."
bubble,before,formal,2019-10-20T04:30:46Z,"We live in a kind of multiverse, each of us in a different virtual bubble, the bubbles occasionally merging in real space and then separating, but always connected through the global social network."
bubble,before,formal,2019-10-19T19:00:40Z,Gently nudge the shallots into the oil and watch it bubble away.
bubble,before,formal,2019-10-19T17:50:00Z,"Not for the first time in recent years it was as if the world inside the chamber bore no relation to that outside its doors, a Westminster bubble indeed."
bubble,before,formal,2019-10-19T12:30:26Z,"From the beginning, Led By Donkeys had been conscious it could be accused of only existing in a bubble, but now it has the resources to reach a much wider audience."
bubble,before,formal,2019-10-18T19:00:13Z,"By torching, I mean all the propaganda about the “bubble”."
bubble,before,formal,2019-10-18T19:00:13Z,"Far too busy for all this bubble business, like debating a plan, or even articulating one, beyond we’re not panicking, if we need stimulus, at least it won’t be crap like Labor’s."
bubble,before,formal,2019-10-18T11:00:52Z,"It’s good to be informed too: we live in a bubble, but my best friends are mostly from school and university and it’s good to put yourself in [other people’s] skin."
bubble,before,formal,2019-10-18T10:00:53Z,"It is a blissed-out track, never coming down from a higher state of consciousness, that occasionally goes a bit heavy on the phasing effects but otherwise burbles along like deluxe bubble bath."
bubble,before,formal,2019-10-18T09:51:55Z,"But there is one long dinner-party scene in which a group of affluent, professional women, who live in their own liberal bubble, find their assumptions questioned by a mutinous guest."
bubble,before,formal,2019-10-17T06:24:44Z,"This is an interesting story from AAP: The Canberra bubble is truly full, with countries looking to set up shop in the capital being turned away because of a lack of available land."
bubble,before,formal,2019-10-15T23:01:06Z,"In footage recorded off Baranof Island in south-east Alaska, whales corral young salmon in “bubble nets”, then rise up from beneath and swish the fish into their mouths with elaborate movements of their pectoral fins."
bubble,before,formal,2019-10-15T23:01:06Z,"During “horizontal pectoral herding”, the whale creates a bubble net around the fish it is hunting and then rises up at an angle, using one pectoral fin to swish the fish into its mouth."
bubble,before,formal,2019-10-15T23:01:06Z,"In “vertical pectoral herding”, the whale again creates a bubble net but then lunges at the shoal from beneath with its fins pushed upwards."
bubble,before,formal,2019-10-15T08:04:12Z,"The question is why is this Prime Minister, when he’s asked questions, responding with, ‘Oh, that’s just in the bubble,’ or other prevarications, which are all designed to avoid scrutiny?"
bubble,before,formal,2019-10-14T10:15:39Z,Williams is an evergreen performer in midfield and the 35-year-old’s set pieces pierced Everton’s bubble.
bubble,before,formal,2019-10-14T07:09:39Z,"Everything Morrison doesn’t want to talk about is a “bubble” issue, or something he is “not getting into” or “I’ve already answered that” and we all know the issues with getting anything out of government departments."
bubble,before,formal,2019-10-13T18:07:45Z,"Depending on your viewpoint, this is either a sign of Europe’s flourishing tech scene or further evidence of the investment bubble that fuelled bloated valuations of Uber and WeWork and looks set to burst – with potentially disastrous consequences for the economy."
bubble,before,formal,2019-10-13T18:07:45Z,They’re both incredibly big employers.” So when will the bubble burst?
bubble,before,formal,2019-10-13T17:00:12Z,"The September Business Outlook report, released on Monday, said the housing bubble and the aftermath of the banking royal commission had been expected to put credit growth “in the naughty corner” for an extended period."
bubble,before,formal,2019-10-13T17:00:12Z,"“Amid that rising uncertainty, business in particular has wound back the money they spend today to help them sell more in the future.” In Australia, stimulus through interest rate cuts and tax cuts should limit any damage caused by the drought and the deflation of the housing bubble, provided the economy can steer a course clear of global chaos."
bubble,before,formal,2019-10-13T17:00:12Z,"“So, absent a spanner in the works from a global threat, Australia should keep muddling through the aftermath of a housing bubble and a drought."
bubble,before,formal,2019-10-13T14:31:50Z,"This “carbon bubble” hangs over our markets like the housing bubble of a decade ago: if the EIB backs away from new fossil fuel lending, it will help with the slow deflation of that bubble, lessening pressure on the system."
bubble,before,formal,2019-10-13T10:36:06Z,The Depression of the 1930s followed the collapse of a speculative bubble and was made worse by a series of policy blunders.
bubble,before,formal,2019-10-13T07:00:43Z,"When Harold Wilson came to office in 1964, Private Eye put the monarch on its front cover with the speech bubble: “And I hope you realise I didn’t write this crap.” This Queen’s speech is especially inviting of mockery."
bubble,before,formal,2019-10-12T19:00:39Z,"He is incisive, honest and compassionate, and never shirks from popping a bubble."
bubble,before,formal,2019-10-12T06:00:21Z,"The slopes are particularly suited to mile-hungry intermediates, with an efficient network of bubble and chairlifts."
bubble,before,formal,2019-10-11T14:28:00Z,We’re all here living in this micro-bubble of the Rugby World Cup but in three or four weeks we pack our bags and go home.
bubble,before,formal,2019-10-10T15:56:42Z,"I vividly remember playing it in a leisure centre in Cambridge, and long forgotten feelings of humiliation and frustration bubble up as I recall how it felt to be defeated."
bubble,before,formal,2019-10-08T16:23:36Z,"It is not simply that such a position would condemn Protagoras to isolation within his own private bubble, a bubble from which he could not converse with others; it is the inescapable fact that the M/M is the one thing Protagoras claims as absolutely true; so, again, it will take only one person to disagree with it for it to be false."
bubble,before,formal,2019-10-08T16:06:20Z,"I just had to laugh, because sometimes you don’t want to burst someone’s bubble."
bubble,before,formal,2019-10-08T15:59:44Z,"“The glorious media rights bubble is about to burst,” he warned."
bubble,before,formal,2019-10-08T07:54:27Z,I live in a bubble and I don’t know where the game would be played.
bubble,before,formal,2019-10-07T16:39:34Z,As Perriand later recalled: “The upright Salon hadn’t expected its galleries to bubble with such brazen youth.” Corbusier hired her on the spot.
bubble,before,formal,2019-10-06T08:00:21Z,"I spent a great deal of my childhood in libraries and was delighted to find certain truths remain comfortingly universal – carpet tiles so well-trodden they might as well be lino, arrestingly artful bubble writing in the handmade shelf displays and, of course, the ancient lore of librarian staff… For every two or three pleasant employees there is one who is incoherently furious that people keep coming into their place of work and, rudest of all, reading the books therein."
bubble,before,formal,2019-10-06T08:00:13Z,"But there are also nuggets and insights – for example, that hostility to the accumulation of wealth is not new: at the time of the South Sea bubble in 1720 it was demanded that bankers be “tied up in sacks filled with snakes and tipped into the murky Thames”."
bubble,before,formal,2019-10-05T15:20:56Z,"There, the assembled executives were forced to step out of the executive bubble and get back to basics: shopping for food and cooking for themselves."
bubble,before,formal,2019-10-05T06:00:50Z,"We are in a bubble and I think we take that for granted.” As more rounds of pastrami and pickles arrive, there is a more determined tone in the air and the sisters repeat a refrain of not taking any bullshit this time around, particularly from a male-dominated music industry."
bubble,before,formal,2019-10-03T17:51:51Z,Westminster is often accused of operating in its own bubble.
bubble,before,formal,2019-10-01T09:02:39Z,"“What Scott Morrison can’t do here is do what he’s had a tendency to do in recent times, which is to dismiss questions which are legitimate from the media as just gossip or as just being in the bubble."
bubble,before,formal,2019-10-01T07:21:42Z,The numbers suggest that the property downturn could be over and that further rate cuts – the cash rate is already at an all-time low – could inflate another housing bubble.
bubble,before,formal,2019-10-01T05:30:33Z,"As an unpaid volunteer agricultural worker escaping from my London bubble, it was time to pull on my wellies and yomp across a muddy paddock to feed pigs."
bubble,before,formal,2019-09-30T16:41:13Z,"I was astonished to read the novelist Ian McEwan admitting that he lived in a remainer bubble while also saying: “Let’s stop pretending there are two sides to this [Brexit] argument … There aren’t.” If you think that Brexit is a symptom of a complex and systemic breakdown (as I do), you cannot simply dismiss half the country."
bubble,before,formal,2019-09-29T14:52:36Z,"Now the bubble has burst, it is obvious whose interests are served by our economic model – and the class divides are sharpening once again."
