target_word,when,type,date,sentence
bubble,after,formal,2024-12-16T16:44:41Z,"29th over: South Africa 95-1 (Wolvaardt 49, Dercksen 32) Pressure building a little on South Africa as England tighten the screw – though I think Wolvaardt is able to exist in a little calm bubble of her own."
bubble,after,formal,2024-12-16T07:07:11Z,"Carse has a few words, trying to rip Ravindra from his bubble."
bubble,after,formal,2024-12-15T20:28:21Z,"During the flight, personnel paraded up and down the aisles with bubble machines as kids squealed: “Bubbles, bubbles, bubbles!” Streamers, paper snowflakes and tufts of cotton resembling feathery snow dotted the plane and seats."
bubble,after,formal,2024-12-15T08:04:22Z,Labuschagne blows a bubble and smirks.
bubble,after,formal,2024-12-15T00:05:29Z,"A Solange ring (hotlipsbysolange.co.uk, £215) in black cherry or bubble gum pink will give you an instant pop of colour and joy."
bubble,after,formal,2024-12-14T13:42:58Z,This naturally affects how sporting success can be categorised by those outside of Scotland’s bubble.
bubble,after,formal,2024-12-14T06:34:52Z,Head and India pacer Mohammed Siraj had some choice words with each other as the rivalry and tension around a tight series begin to bubble away.
bubble,after,formal,2024-12-13T12:00:47Z,"His latest project, under the alias Bubble Love, is a sharp pivot away from sepia-toned gauziness: it’s a high-energy pop-club record that’s extremely fun, if far from groundbreaking."
bubble,after,formal,2024-12-13T12:00:47Z,"Bubble Love often sounds like the work of someone who only just discovered contemporary alternative dance music, which is not a knock."
bubble,after,formal,2024-12-13T12:00:47Z,"You walk away knowing little about Bubble Love as a project, but certainly not having had a bad time."
bubble,after,formal,2024-12-12T08:43:18Z,"Initially, she thought he might be making a ring-shaped bubble, a diving trick."
bubble,after,formal,2024-12-11T17:00:03Z,"In the main dramatic competition this year, there will be films such as the Luca Guadagnino-produced Atropia about a military role-playing facility starring Alia Shawkat and Callum Turner, the cabbage-smuggling comedy Bubble &amp; Squeak starring Himesh Patel, the 90s-set drama Plainclothes about an undercover cop falling in love with another man starring Russell Tovey, the Cary Fukunaga-produced drama Ricky starring Stephan James as a man navigating life post-incarceration and the dark comedy Sorry, Baby produced by Barry Jenkins."
bubble,after,formal,2024-12-11T03:04:29Z,"“I mean the situation sucks for sure, but the solution isn’t to retreat into a bubble.”"
bubble,after,formal,2024-12-10T12:00:13Z,"With everyone locked down, Joy managed a complete family, the happiest bubble."
bubble,after,formal,2024-12-09T16:38:13Z,"A surge of online shopping during lockdowns inflated a bubble in internet retailers, only for it to burst as spending moved back to the high street."
bubble,after,formal,2024-12-09T16:00:16Z,"There’s no Christmas branding; it arrives in a neat pink cardboard box with shredded paper, a recyclable ice pack and a bubble-wrap envelope, so there isn’t much packaging for which to find a home."
bubble,after,formal,2024-12-09T15:41:20Z,"A surge of online shopping during lockdowns inflated a bubble in internet retailers, only for it to burst as spending moved back to the high street."
bubble,after,formal,2024-12-08T20:35:59Z,"Still not quite enough sass.” gliese says: “Go Tash, all bubble and glitz and gritty - loved it!"
bubble,after,formal,2024-12-07T19:12:10Z,"Red 3 is used in nearly 3,000 food products, according to a database by one environmental health group, including Pez, Betty Crocker’s products and Dubble Bubble chewing gum."
bubble,after,formal,2024-12-07T12:11:45Z,"75th over: Australia 273-5 (Head 114, Carey 12) Australia deal in singles against Siraj with half the Adelaide Oval outfield shrouded in bubble-shaped shadows cast by the silhouette of the beautiful stands."
bubble,after,formal,2024-12-07T05:00:16Z,"“We live in a very progressive bubble, but outside this bubble I think there is still a lot of rejection and a lot of hate.” For member Fabian Schipfer, the reaction was in some ways unsurprising."
bubble,after,formal,2024-12-06T15:00:58Z,"Heat until the mix reaches 155C, then strain the cream into the caramel pan, whisking to incorporate – the mixture will bubble up rapidly, so be careful because it’s extremely hot."
bubble,after,formal,2024-12-06T00:51:35Z,"Love for the world is love for the way the milk makes a thundercloud in the tea, or for an interesting bubble of dish detergent, as much as for making a difference or having views on the state of things."
bubble,after,formal,2024-12-04T09:00:03Z,Iowa State are on the bubble with a current net of 8.9.
bubble,after,formal,2024-12-03T12:00:49Z,"She points to another image of an “uncle”, Latif, a 70-year-old retired businessman, in a plain shalwar kameez, air-bubble trainers and a topi (cap) that he’s been wearing for more than 20 years, given to him by a friend."
bubble,after,formal,2024-12-02T13:36:11Z,"*** TikTok skincare Bubble Cloud Surf Water cream moisturiser, £16 for 50ml beautybay.com boots.com Bubble skincare is all the rage on TikTok and, fortunately, it’s good."
bubble,after,formal,2024-12-02T11:13:29Z,"The company is also likely to have been been hit by a fall in tea consumption in Britain, with younger consumers turning to coffee, energy drinks and newer trends such as bubble tea."
bubble,after,formal,2024-11-30T22:15:58Z,"The pass back into Saka’s path was a thing of beauty, floated like a soap bubble through the damp Stratford air, and also through the human props posing as West Ham defenders."
bubble,after,formal,2024-11-29T13:00:08Z,"“There’s no bubble where the tourism people live and the other people live, and they go to different grocery stores, and their kids go to different schools, and they go to different hospitals.” She emphasises the ripple effect tourism has on secondary businesses – electricians, food producers, mechanics, fuel stations, for example – and how it provides jobs for young people, who might have few prospects otherwise."
bubble,after,formal,2024-11-29T10:09:00Z,"Increase the heat to high and bubble for 3 minutes, then whisk in a pinch of salt and the brandy."
bubble,after,formal,2024-11-29T08:00:05Z,"In an industry where young talent is less responsive to old-school authority, and conditioned by the social media bubble, such intelligence becomes more vital than ever."
bubble,after,formal,2024-11-29T08:00:02Z,Fashion week is a bubble that doesn’t mean all that much on its own.
bubble,after,formal,2024-11-28T17:47:26Z,"It is indeed a “bubble of delusion”, and Monbiot is right: “You can send your legions to war with reality, but eventually we all lose.” Jean Glasberg Councillor, Cambridge city council • Do you have a photograph you’d like to share with Guardian readers?"
bubble,after,formal,2024-11-26T08:00:05Z,"Use a stick blender to blitz the squash mix to a smooth soup, then return to a low heat and leave to bubble away gently."
bubble,after,formal,2024-11-26T07:11:51Z,"Bubble tea franchise Chatime fined $132,840 for underpaying workers The Fair Work Ombudsman has fined bubble tea franchise Chatime and its managing director $132,840 for the underpayments of more than $160,000 to vulnerable employees at 19 stores across Sydney and Melbourne."
bubble,after,formal,2024-11-25T20:00:04Z,"When I was 12, I would wake up in the morning and open the curtains and pray it wasn’t raining so I could play.” Root concedes that, especially during his difficult years as captain and the grind of enduring a Covid bubble, “you obviously need little reminders here and there … but I can sit here now and say that, thankfully, I enjoy playing cricket as much as I did 12 years ago."
bubble,after,formal,2024-11-24T12:00:12Z,"“When you go to Cabaret, you’re like: ‘Where can I find that seafoam-green coat that looks like [it’s] straight off the Gucci runway?’” When you go to Wicked, you leave wanting to find emerald green, pastel pink and bubble skirts."
bubble,after,formal,2024-11-24T07:00:08Z,"The Australian actor’s brief monologue, notoriously delivered from a champagne bubble bath, explained how banks were bundling up their growing cache of risky sub-prime mortgages into investable bonds, before slicing them up and selling them off for profit."
bubble,after,formal,2024-11-21T12:25:40Z,"As investments go, there hasn’t been a worse return since the NFT bubble."
bubble,after,formal,2024-11-21T08:00:41Z,"Thank God hooliganism has disappeared,” he says, somewhat forgivingly, of the hooliganism that does still bubble to the surface, even if it is minimal compared with what it was in the 90s."
bubble,after,formal,2024-11-21T06:00:39Z,This bubble of delusion will burst.
bubble,after,formal,2024-11-20T08:00:31Z,Allow to melt and bubble without colouring.
bubble,after,formal,2024-11-20T08:00:31Z,Bake in the oven for 15 minutes until it turns golden brown and starts to bubble.
bubble,after,formal,2024-11-19T14:00:09Z,Dutton said it was a “thought bubble” and could not see how the Coalition could make a “bad bill” better.
bubble,after,formal,2024-11-19T07:00:31Z,"So we fried up a sort of bubble and squeak, fought over the best burnt bits, drank red wine, wondered: if the world ended, would we even realise?"
bubble,after,formal,2024-11-18T06:55:31Z,"They have their snouts in the trough so far that they’re blowing that many bubbles I could jump in and have a bubble bath … there is nothing I can think of worse, towards the end of the year, the end of sittings, and all the major parties are worried about is money and trying to maintain their seats."
bubble,after,formal,2024-11-18T06:15:46Z,The independent senator Jacqui Lambie said major parties “have their snouts in the trough so far that they’re blowing that many bubbles I could jump in and have a bubble bath”.
bubble,after,formal,2024-11-17T19:09:15Z,"There was a heavy touch from Kane that led to Scales slamming into him to win a showy tackle and the frustrations seemed to bubble over in first-half stoppage time, Kane throwing Jayson Molumby to the ground to incur a yellow card."
bubble,after,formal,2024-11-16T17:00:44Z,"Geographically speaking, York is now the capital of bubble tea, Brighton of oat milk, and Tunbridge Wells of champagne."
bubble,after,formal,2024-11-16T15:55:30Z,Spurs started the second 45 well but they just couldn’t puncture Arsenal’s defence when they had the momentum and their bubble burst when Blackstenius scored.
bubble,after,formal,2024-11-16T11:00:37Z,"The annoyance wasn’t so much that he was shopping for sex as that, for an exceptionally long stretch, he was doing something a lot of people in this gym do: use their phones to distract themselves between sets, but also to stay in the bubble that justifies their obliviousness to the people waiting for them to be finished."
bubble,after,formal,2024-11-16T07:00:35Z,13 Bubble; carnation; lettuce leaf; grooved brain; organ pipe; staghorn?
bubble,after,formal,2024-11-15T15:44:11Z,"Typhoo, which was founded in 1903 by the Birmingham grocer John Sumner, has been struggling for a number of years as many drinkers have switched from tea to coffee, energy drinks and newer trends such as bubble tea."
bubble,after,formal,2024-11-15T14:00:14Z,"Sign up for our rundown of must-reads, pop culture and tips for the weekend, every Saturday morning As in all family gathering plays, tensions bubble over, grenades are lobbed and secrets are revealed."
bubble,after,formal,2024-11-15T14:00:11Z,"If you did that anywhere else in London, out of this bubble, people would be like: ‘You’re weird’."
bubble,after,formal,2024-11-15T12:09:08Z,"Still, because our town is considered such a progressive bubble, we never thought the tone of the election was connected to the changes we were observing in our male peers."
bubble,after,formal,2024-11-15T11:34:44Z,"Vertical’s share price has plunged 95% since the Covid pandemic bubble, valuing it at only $110m."
bubble,after,formal,2024-11-15T11:34:44Z,"“There was a massive bubble,” said an industry source."
bubble,after,formal,2024-11-14T11:00:13Z,They went out for bubble tea together and “really hit it off”.
bubble,after,formal,2024-11-13T11:13:16Z,"The movie was condemned by the Mormon church, but for others it struck a chord, with one saying: “You’re sending 18-year-olds out into the world who have grown up in a bubble.” Climate check: ‘No sign’ of promised fossil fuel transition as emissions hit new high For the world to stand a chance at meeting the 1.5C temperature target, emissions must fall by 43% by 2030."
bubble,after,formal,2024-11-12T17:37:50Z,"“You’re sending 18-year-olds out into the world who have grown up in a bubble and shelter of Mormonism,” she said."
bubble,after,formal,2024-11-11T16:00:30Z,"It’s almost imprisonment.” Lee Brennan, a member of earlier group 911, sees his time in the boyband bubble slightly differently."
bubble,after,formal,2024-11-11T11:00:02Z,"Pour in the wine, soy sauce and sugar mixture and let it bubble away until it thickens, adding a splash of water if it thickens too much."
bubble,after,formal,2024-11-11T11:00:00Z,"Everyone thinks you’re great in this bubble of art school” he says, “then suddenly you’re performing to a plumber.” His best pal from school, Mikey Bligh-Smith, had also been experimenting with alternative comedy while studying in Bristol."
bubble,after,formal,2024-11-10T11:00:14Z,"You can contribute.” In rehearsal for Swan Lake, she tells me, the cast was in a bubble."
bubble,after,formal,2024-11-10T06:30:09Z,"Bubble First Class Oil Cleanser, £17, boots.com Brush with fame Mason Pearson are famed for their beautifully made hair brushes."
bubble,after,formal,2024-11-09T16:15:53Z,"The consensus arguably broke a long time ago, when the bursting of the housing bubble of the early 00s left many would-be homeowners crippled by debt and led to the deepest economic crisis since the Great Depression."
bubble,after,formal,2024-11-09T15:18:53Z,"One of the most common centrist takes has been: Democrats have become too progressive and “woke” on social issues and obsessed with identity politics, and Democratic staffers and consultants live in a bubble and speak in alienating ways that have made them seem radical and off-putting to the median voter."
bubble,after,formal,2024-11-08T21:00:28Z,"In the second episode, tiny, bubble-curled Maisie asks him with curiosity: “Is this what you’ve been paid to do?” It is, and thank goodness."
bubble,after,formal,2024-11-07T10:00:02Z,"Wilde himself described it as “a delicate bubble of fancy”, but added: “It has its philosophy.” At the time its philosophy was hard to discern."
bubble,after,formal,2024-11-06T17:07:56Z,"Attractive as the filter bubble model is, research has shown that the realities are far more complicated and less siloed than we may want them to be."
bubble,after,formal,2024-11-06T05:33:05Z,"Finally, tens of millions of anxious voters were done with the wildest campaign in their lifetimes and found themselves in that next stage of exquisite suffering that is the American way of democracy: the TV election night bubble."
bubble,after,formal,2024-11-04T17:00:55Z,"Football is not immune ; although they’re often held up as supermen, accused of living in a bubble where they can’t be touched, players are not invincible."
bubble,after,formal,2024-11-04T11:06:25Z,The silly point – it’s Kamran Ghulam – is still rabbiting on in an attempt to drag Cummins out of his bubble.
bubble,after,formal,2024-11-04T11:00:14Z,Woodwind and synths bubble in maximalist splashes of colour.
bubble,after,formal,2024-11-03T14:38:07Z,"Barely rising above a pianissimo, Ma’s ethereal phrasing and Stott’s measured cascade of notes created a meditative bubble so fragile that no one dared applaud at the end for fear it might burst."
bubble,after,formal,2024-11-03T13:00:44Z,"The Fed is supposed to behave as if it lives outside the political bubble, away from the daily jousting in Congress and the White House."
bubble,after,formal,2024-11-03T11:05:54Z,"“Playing for England always felt like I was living in a dream bubble,” Marler, who will continue to play for Harlequins, wrote on social media."
bubble,after,formal,2024-11-03T11:05:54Z,Time to exit one dream bubble; time to enter a new one.
bubble,after,formal,2024-11-03T11:00:42Z,"“We were in a beautiful sacred sound bubble just now, it is a bit hippy and airy-fairy, but I marry this with the world of science,” she says."
bubble,after,formal,2024-11-02T08:00:09Z,"Knitting, Daley explained after the images of him mid-purl went viral, had been a distraction from the intense pressure of competition, and from the tedium of life in the pandemic-hit Games bubble."
bubble,after,formal,2024-11-02T06:00:08Z,"Along with expert guests, Zitron discusses everything from the AI bubble to Silicon Valley fashion."
bubble,after,formal,2024-10-31T17:17:55Z,"A total of 24 Lush goodies, festively themed: Father Christmas bath bombs, candy cane bubble bars, “Yog Nog” body lotion, Merry Kissmas lip scrub, a Christmas lights soap, shower gels, a perfume."
bubble,after,formal,2024-10-31T17:05:17Z,"This rapid-fire approach is impressively succinct, allowing pop hooks and booming beats to fizz and bubble before quickly settling down and disappearing – but it can also feel slightly bitty and restless."
bubble,after,formal,2024-10-30T14:00:20Z,"Edited in iMovie, of course, with bubble text in the corner: “Fruit Bat – by Ruby Teys”."
bubble,after,formal,2024-10-30T08:00:04Z,"Lower the heat, then add the light soy sauce, dark soy sauce and sugar, to taste, to the hot oil in the pan – note that it will bubble a bit."
bubble,after,formal,2024-10-30T08:00:04Z,"Add the pumpkin to the mix, then pour over 500ml just-boiled water and bring to a vigorous bubble."
bubble,after,formal,2024-10-29T14:00:13Z,"“Add some wine, leave it to bubble and reduce, then add any other flavourings and tip into the meat tray.” If a stew or braise is your jam, meanwhile, remember that low and slow will win the day: “It will also taste so much better if it’s made ahead of time, left to cool, and reheated,” Gyngell says."
bubble,after,formal,2024-10-28T11:04:31Z,Even seasoned aficionados of avant-garde music are unlikely to have witnessed a musician playing a mini concerto for bubble wrap.
bubble,after,formal,2024-10-28T11:04:31Z,"During a rubato-heavy “solo”, where she crunches some small-gauge bubble wrap and then “pops” a particularly large variety of industrial packaging, she even elicits applause."
bubble,after,formal,2024-10-27T06:00:03Z,"‘Posturing, vulnerable, helplessly aggressive, he looks good having sex.’ At the press junkets Leith attended, Gere seemed to be sealed in a ‘bubble of feline grace’, exuding poise and, above all, control, discussing his work and his faith."
bubble,after,formal,2024-10-26T05:00:22Z,"Cook, stirring occasionally, for about 10 minutes, until the mixture starts to bubble and caramelise, and turn a dark golden brown, then take off the heat and put to one side."
bubble,after,formal,2024-10-26T05:00:22Z,"When the milk mixture starts to steam and you see a bubble or two appearing on the surface, take off the heat, whisk in the vanilla extract and beat until any lumps dissipate."
bubble,after,formal,2024-10-25T12:40:54Z,"Saud Shakeel is still there, having batted in a bubble to make a splendid 72 not out, so England aren’t guaranteed a first-innings lead."
bubble,after,formal,2024-10-25T12:40:54Z,"61st over: Pakistan 182-7 (Saud 71, Noman 2) Saud trusts Noman, who made a vital 32 in the first innings at Multan, and is still batting in his bubble."
bubble,after,formal,2024-10-25T12:40:54Z,"Good on Stokes!” 53rd over: Pakistan 159-6 (Saud 61, Jamal 3) Saud Shakeel is batting beautifully and doesn’t need to come out of his bubble just yet, although he will if he’s still at the crease when Pakistan are eight down."
bubble,after,formal,2024-10-25T12:00:02Z,You don’t work in a bubble.
bubble,after,formal,2024-10-25T11:00:41Z,"“The life of a rabbi is not isolated and stuck in a bubble of community, it’s with society, and you meet all kinds of different people and all different kinds of parts of life."
bubble,after,formal,2024-10-24T11:07:06Z,“They knew they’d lost the game but they just wanted to burst the bubble for us.
bubble,after,formal,2024-10-23T11:16:17Z,"The bar in the Rocks is known for its pastel-pink-jacketed, bubble-gun-wielding bar staff as much as it is for its Instagram-ready cocktails."
bubble,after,formal,2024-10-23T06:00:02Z,"When it became clear that 51% of voters had showed up – more than in other recent elections – everyone in my bubble felt optimistic, posting pictures of their “I voted” blue stickers given out at polling stations."
bubble,after,formal,2024-10-23T05:00:01Z,"The new cracks create a sudden drop in pressure, which destabilises the methane hydrate and releases an explosive bubble of methane gas."
bubble,after,formal,2024-10-22T16:09:48Z,"Deutsche Bank’s Jim Reid argues that it’s “better to be lucky than good”, meaning events are more likely than policy to dictate big-picture market performance under the next President: The big outliers were driven by events that were arguably mostly outside of the control of the sitting President, namely the Depression, the 1973 oil shock, and the double whammy of the post-2000 bubble unwind and the early GFC shock of the George W."
bubble,after,formal,2024-10-22T16:09:48Z,"Academics have argued that Hoover’s policies exacerbated the Depression, but you only have to look at the returns under Coolidge (the highest of any president) over 1923-29 to see that he likely presided over a bubble that contributed to the subsequent 1929 crash, even if he had left office earlier that year."
bubble,after,formal,2024-10-21T08:56:50Z,"Lidia Thorpe burst that warm bubble on Monday, marching towards the stage and yelling for a treaty, as Albanese and his fiancee, Jodie Haydon, leaned over to whisper in nearby respective royal ears."
bubble,after,formal,2024-10-17T13:53:41Z,"On CNN, Stelter speculated that viewers might hear these comments and go searching online for more, thus piercing the information bubble they’ve been living in."
bubble,after,formal,2024-10-16T08:10:46Z,"And China, the world’s largest consumer of oil, is in the midst of a dramatic slowdown brought on by a housing bubble bursting in spectacular fashion."
bubble,after,formal,2024-10-15T12:23:59Z,"Well, it means I live in a liberal bubble."
bubble,after,formal,2024-10-14T22:15:16Z,"This may allow the row to continue to bubble, and the Tories are certainly capitalising on this."
bubble,after,formal,2024-10-14T17:00:33Z,"And that’s a sure sign – when a founder and owner of a company, you see more of them on an algorithm, despite not liking them – [of] something going on.” He added: “I think that it is totally and completely wrong and harmful to British democracy that the Westminster bubble gets to know each other through a ranking model designed by a man who’s spending his life campaigning for Donald Trump."
bubble,after,formal,2024-10-13T19:39:17Z,"However, when he wasn’t on the physio’s table, he clearly enjoyed his month in the sparkly Strictly bubble."
bubble,after,formal,2024-10-12T06:00:19Z,"They’re waiting for the moment of betrayal after so many years of being let down.” * * * Internal frustrations within Starmer’s top team, which had been kept at bay by the election, began to bubble over, with Gray increasingly becoming the lightning rod."
bubble,after,formal,2024-10-10T12:18:42Z,"Saedi had implemented a “double bubble” loan scheme, which required cash-strapped colleagues who borrowed from him to repay double the amount on their next pay day."
bubble,after,formal,2024-10-10T11:00:18Z,"“We had been working really hard doing our thing all those years, but until the explosion on Instagram, we had been in a bubble,” says Collins."
bubble,after,formal,2024-10-09T11:00:12Z,"Put this in a small pan with the dates and sugar, add water just to cover, then bring to a simmer and leave to bubble away until the dates are soft and pulpy."
bubble,after,formal,2024-10-09T09:00:10Z,"In the Aipac meeting, Scalise scolded the former university chiefs for existing in a bubble in which Palestinians were painted as the real oppressed group."
bubble,after,formal,2024-10-09T09:00:10Z,"“You start siding with a terrorist organization, and you think that’s mainstream, because all your friends are in this little bubble, and I don’t know who you’re talking to – you’re sure not talking to normal people any more,” he said."
bubble,after,formal,2024-10-08T21:30:01Z,"Yet it probably says everything about Colwill that he has chosen to leave the Cobham bubble, where many of his teammates live and hang out, and return to live with his family in Southampton."
bubble,after,formal,2024-10-08T21:30:01Z,"“Being in the bubble when you’re at your club is great but when you come home it’s more of a peaceful, normal life."
bubble,after,formal,2024-10-08T06:00:24Z,"By adhering to a stand-back-and-watch approach, Goudsmit lets the comedy of the situation bubble naturally to the surface; in one scene, for example, Chavail, bless his cotton socks, explains how he’s considering careers as “a preacher, foot therapist, porn star, actor, salesman of some sort, host or nude model” should the Michael Jackson impersonating not work out."
bubble,after,formal,2024-10-07T14:00:08Z,"But 7 October burst the bubble, not only on our borders, but also in our lands of inspiration."
