target_word,when,type,date,sentence
bubble,before,formal,2019-12-30T07:40:23Z,"The capital is a bubble into which she has escaped from her deprived childhood and within which she thinks herself protected, despite its periodic punctures by her mother’s phone calls and constant requests for cash."
bubble,before,formal,2019-12-30T07:40:23Z,"The man who brings her into the bubble within the bubble, upper-class London, and introduces her to all the right people who are so very wrong for her, is society osteopath Stephen Ward (James Norton, perhaps too earthy a casting choice for the part, though his creepily patronising delivery of “little baby”, his nickname for Keeler, is worth the price of admission)."
bubble,before,formal,2019-12-29T10:00:35Z,"2 Leave the hot milk to cool As soon as the milk begins to bubble, turn off the heat and leave it to cool down to blood temperature."
bubble,before,formal,2019-12-29T10:00:00Z,"16 min: This is starting to bubble a little, as Rostyn Griffiths is penalised for a foul on Milos Ninkovic."
bubble,before,formal,2019-12-28T15:44:27Z,"We thought he was a Gold Cup horse and obviously our bubble burst at Down Royal, but we’re not gone yet.” Delta Work was cut to a top price of 10-1 for the Gold Cup after the win, while last year’s Savills Chase winner, Kemboy, is unchanged at 6-1 after finishing fourth on his return to action after 241 days on the sidelines, within four lengths of the winner."
bubble,before,formal,2019-12-28T11:30:07Z,"Prep 20 min Cook 20 min Serves 12 For the toffee sauce 150ml double cream 40g unsalted butter 50g light muscovado sugar ¼ tsp fine sea salt For the brittle 230g caster sugar 20g unsalted butter 150g mixed nuts, roughly chopped For the trifle 600g extra-thick double cream 100ml Baileys 400g chocolate digestives, broken 5 large bananas, peeled and sliced 2 x 500g ready-made vanilla custard To finish 75g dark chocolate, grated Melt the cream, butter and sugar in a medium-sized saucepan, then leave it to bubble and turn a toffee sauce-like colour."
bubble,before,formal,2019-12-28T06:00:01Z,"On 29 December 1989, Japan’s Nikkei stock market index hit a high of 38,916, a milestone that proved to be the last hurrah of the country’s asset-inflated bubble economy – a period of ostentatious consumption and overconfidence in the infallibility of Japan, Inc."
bubble,before,formal,2019-12-28T06:00:01Z,"When the bubble party ended, its hosts appeared to have no idea how to clean up the mess left by absurdly high share and property prices."
bubble,before,formal,2019-12-28T06:00:01Z,"“Japan’s 1980s bubble was the bursting start of a long adaption from a young, fast-growing economy to an ageing, slow-growth new normal,” says Martin Schulz, senior economist at the Fujitsu Research Institute."
bubble,before,formal,2019-12-28T06:00:01Z,"What’s missing are better work-life balances to enable families to have children again, and a more proactive stance to deal with the long-term debt overhang.” The end of the bubble era coincided with the enthronement of a new emperor."
bubble,before,formal,2019-12-28T06:00:01Z,"While Akihito sought to bring the imperial family closer to ordinary people, much of his three decades on the Chrysanthemum throne, which ended with his abdication this April, was marked by policy drift and a creeping fear that Japan’s post-bubble woes were merely the precursor to long-term decline."
bubble,before,formal,2019-12-28T06:00:01Z,"It wasn’t long before optimism over Abenomics, at home and abroad, began to chip away at the “lost decades” narrative that followed the bubble era."
bubble,before,formal,2019-12-27T19:00:47Z,"It’s arguable a cowboy culture in the industry stretches as far back as the Victorian land boom of the 1880s and 1890s, when soaring property prices and easy credit provided by a string of fledgling banks and building societies helped create a speculative financial bubble – the pricking of which saw fortunes destroyed and corrupt premier James Munro bankrupted and beaten in the street."
bubble,before,formal,2019-12-27T10:00:37Z,"Both of them aimed to adapt to “new times”, acknowledging, respectively, that in the 1980s Thatcherism had dismantled the old Labour class coalition, making the young, working population likely to vote Tory; and that the 2008-09 financial crisis had made Blairism’s giddy bubble economics extremely implausible."
bubble,before,formal,2019-12-27T09:30:36Z,“Why would you open a restaurant if you could open a bubble waffle stand that dished out amazing-looking cheap carbs at nine quid a throw?
bubble,before,formal,2019-12-27T07:00:35Z,"Or perhaps not quite sated, given how handy the surplus can be to fold into bubble and squeak, or sandwiches."
bubble,before,formal,2019-12-25T18:00:48Z,"GSK developed one of the first gene therapies, Strimvelis, for a rare immune deficiency known as “bubble baby” syndrome."
bubble,before,formal,2019-12-25T08:00:36Z,"But I live in my own bubble.” She has received messages accusing her of being too flamboyant and, when she was first hired, the former Dancing on Ice judge Louie Spence called her a “nobody”, accusing the BBC of “box-ticking” for diversity."
bubble,before,formal,2019-12-25T08:00:36Z,"“I don’t get that involved in politics because I’m in my dance bubble,” she says, but she does feel that diversity is treated as a “fad” in Germany."
bubble,before,formal,2019-12-24T14:59:23Z,Boots is offering half-price discounts on selected No7 cosmetics and Oral B toothbrushes as well as some Christmas gift collections such as Champneys bubble bath.
bubble,before,formal,2019-12-24T10:00:10Z,They’re the bubble.
bubble,before,formal,2019-12-23T12:00:43Z,"The stir-fry The other standout winner of our taste test comes from my colleague Meera Sodha, who describes her turkey curry with shredded brussels sprouts, caramelised onions and ginger as “more interesting than your traditional bubble and squeak … warming, spicy, healthy and tasty”."
bubble,before,formal,2019-12-23T12:00:43Z,"Scrape any solids off the base of the pan, stir in the sugar and a good pinch of salt, bring to a simmer, then turn down the heat slightly and leave to bubble gently for about 20 minutes, until thickened."
bubble,before,formal,2019-12-23T09:00:40Z,"Even overcooked sprouts can be transformed into a delicious brunch, mashed with potatoes to make colcannon or bubble and squeak."
bubble,before,formal,2019-12-22T06:59:54Z,"I’ve raised this for a considerable period of time – it is part of Mr Morrison’s character that when asked a question, that’s just a straight question, he dismisses it, or he prevaricates, he speaks about the bubble, or he says it’s just gossip and he won’t provide answers to simple question whether it’s in parliament or from the media."
bubble,before,formal,2019-12-22T06:08:07Z,"I think it’d be good to get out of the London bubble and see someone lead the party from up north.” Backing Long Bailey for leader over Keir Starmer, Emily Thornberry or Lisa Nandy might seem the obvious choice for Labour members who have previously supported Corbyn."
bubble,before,formal,2019-12-19T08:14:40Z,"“This lawless partisan impeachment is a political suicide march for the Democrat party.” But Trump’s fierce efforts to seal himself in a bubble of adulation, and his insistence that Republicans pretend away the existence of facts threatening to pierce that bubble, could not divert the historic reality coalescing on Capitol Hill."
bubble,before,formal,2019-12-19T06:30:40Z,"But despite critics’ complaints that Airbnb is changing the nature of the very neighbourhoods it aims to celebrate, there are no signs that the bubble is about to burst."
bubble,before,formal,2019-12-18T10:00:15Z,"I lingered in the back of the crowd, trying to spot which pocket had a bulge that would promise a ball of bubble gum."
bubble,before,formal,2019-12-18T01:15:05Z,"Government becomes a problem to be solved, a “bubble”, a “swamp” of compromised technocrats and bean-counters operating against the interests of hard-working common folk, the “quiet Australians” whose will for a simple life is constantly being frustrated."
bubble,before,formal,2019-12-17T09:30:46Z,"It kept her in a warm bubble – safe from the world, protecting her from harsh reality – which is where she wanted to stay."
bubble,before,formal,2019-12-17T06:26:46Z,Ben Stokes described himself as the “boy in the bubble” as the BBC Sports Personality of the Year thanked his teammates and the sport of cricket for helping him through his trial for affray and into a summer of sporting glory.
bubble,before,formal,2019-12-16T22:30:32Z,Ben Stokes described himself as the “boy in the bubble” as the BBC Sports Personality of the Year thanked his teammates and the sport of cricket for helping him through his trial for affray and into a summer of sporting glory.
bubble,before,formal,2019-12-16T22:30:32Z,"“When you’re out there as a batsman, I just try to envisage myself as a boy in a bubble."
bubble,before,formal,2019-12-16T15:09:37Z,"With its flag tightly wrapped around a glass bubble, it looks like a little Brexit capsule, safely sealed off from the free movement and free markets of the outside world."
bubble,before,formal,2019-12-16T11:00:20Z,"Add a little white wine or marsala and leave to bubble for 10 minutes, until the sausage is cooked and the wine has evaporated."
bubble,before,formal,2019-12-16T08:58:16Z,"They are marketed to a relatively literate audience, without the mass-market paraphernalia that is applied to, for example, the memoirs of former Para, Marine and Special Boat Serviceman Ant Middleton, whose autobiography First Man In: Leading from the Front was propelled to the top of the charts partly because of his role as instructor on the Channel 4 series SAS: Who Dares Wins; his new book, Fear Bubble, has sold more than 50,000 copies."
bubble,before,formal,2019-12-15T17:00:57Z,"LW Read the full review 1 Oona Doherty: Hard to be Soft – A Belfast Prayer There’s a brilliant voiceover in Hard to Be Soft, in which a young woman describes herself and her friends in Oona Doherty’s home town of Belfast: “This little bubble that has tragedy in the walls.” Their defiance has a physical manifestation, she says, the importance of putting on a good face."
bubble,before,formal,2019-12-15T16:15:34Z,"He is particularly dismissive of the Today programme, which he argues operates in a metropolitan bubble out of touch with the rest of the country."
bubble,before,formal,2019-12-14T16:00:27Z,"“A shared responsibility for wellbeing falls on to each one of us: the companies designing applications and user interfaces that play on our psychology, but also on policy makers.” How that would look in practice is likely to be the result of years of legal wrangling – but watch the proposals bubble up over the next year."
bubble,before,formal,2019-12-14T09:00:19Z,"One of my first jobs was to compile a Christmas gift guide for a magazine and, looking back, I see that in my “gifts for her” section I included – and I swear I’m not making this up – a pink sequined beret and some bubble bath."
bubble,before,formal,2019-12-14T09:00:19Z,"And, no, suggestions of “what to get for your hipster boyfriend” (a £500 coffee grinder) or “your luxury-loving girlfriend” (Chanel bubble bath) do not count (actual examples from an actual magazine)."
bubble,before,formal,2019-12-13T14:30:48Z,Am I in a bubble?
bubble,before,formal,2019-12-12T16:38:07Z,W Westminster bubble: You’ll have heard the phrase: “Politicians needed to get out of the Westminster bubble and speak to real people.” Today is the day that the “real people” get to speak.
bubble,before,formal,2019-12-12T08:00:01Z,This is known as the “filter bubble” problem.
bubble,before,formal,2019-12-10T17:49:45Z,"One artwork is a screen cast in resin, depicting a water bubble floating to the surface, while another is titled 100% Humidity."
bubble,before,formal,2019-12-10T06:30:02Z,"The bee-themed restaurant likes to flavour dishes with Cotswold honey, including the keepers pizza with roast veg and rocket (£11.95) and a honey bubble cocktail, featuring vodka, raspberries and prosecco (£8.50)."
bubble,before,formal,2019-12-10T03:59:05Z,"The most striking thing about the weeks of fire has been the way we Sydneysiders have come to ignore it and carry on regardless, inhabitants of a wealthy international city, kidding ourselves we are immune to broader debates, that the things that go on in Canberra are, as Scott Morrison would have us accept, just part of some bubble of make believe."
bubble,before,formal,2019-12-07T16:15:19Z,"Jeremy Corbyn said “the Westminster bubble” didn’t care about buses, despite the fact that so many people rely on them."
bubble,before,formal,2019-12-07T11:00:08Z,"Add to the pork, then deglaze the pan with the sherry, letting it bubble for about 30 seconds, before pouring the reduction into the mixing bowl."
bubble,before,formal,2019-12-06T22:30:54Z,"Jeremy Corbyn said “the Westminster bubble” didn’t care about buses, despite the fact that so many people rely on them."
bubble,before,formal,2019-12-06T22:30:54Z,"“The Westminster bubble doesn’t care about buses but cuts to bus routes leave so many people isolated, stuck at home and unable to make vital trips out,” said Corbyn."
bubble,before,formal,2019-12-06T19:00:50Z,Our story needs to start with the bubble.
bubble,before,formal,2019-12-06T19:00:50Z,Morrison invoked the bubble.
bubble,before,formal,2019-12-06T19:00:50Z,Canberra was the bubble.
bubble,before,formal,2019-12-06T19:00:50Z,"The bubble works, conceptually, as a brand, because a lot of voters believe it exists."
bubble,before,formal,2019-12-06T19:00:50Z,"Bad business, that bubble."
bubble,before,formal,2019-12-06T19:00:50Z,"Morrison’s bubble is multipurpose: both sword, shield, and safety deposit box."
bubble,before,formal,2019-12-06T19:00:50Z,"The bubble is invoked to malign conduct from opponents he finds inconvenient, and to deflect questions he doesn’t want to answer."
bubble,before,formal,2019-12-06T19:00:50Z,Anything not to the prime minister’s liking can also be confined to the bubble.
bubble,before,formal,2019-12-06T19:00:50Z,That’s a bubble preoccupation.
bubble,before,formal,2019-12-06T19:00:50Z,A bubble question.
bubble,before,formal,2019-12-06T19:00:50Z,"The bubble language is not invoked constructively, to try and drag a rancid, rotting institution into self-correction and catharsis."
bubble,before,formal,2019-12-06T19:00:50Z,"Apart from divide and conquer, the oldest trope in politics, there’s another dimension to Morrison’s rolling parable of the bubble-dwellers versus everyone else, and it became profoundly obvious during the final two rancorous parliamentary sitting weeks of 2019."
bubble,before,formal,2019-12-06T19:00:50Z,"If Canberra is a bubble comprised of washed up high school debaters and circus performers, if you can make that reality stick, then none of what happens in that arena matters."
bubble,before,formal,2019-12-06T19:00:50Z,"Why sweat the small stuff?) If no one is required to be precise, or accurate, then it doesn’t matter if Taylor keeps tripping over himself, again and again, making mistakes ministers should not make, and suffers no apparently penalty, because this is a bubble issue."
bubble,before,formal,2019-12-06T16:48:14Z,"Lucy Pendleton of estate agents James Pendleton: “Contributing to the pick up in the annual pace of growth is the London market, which has started to bubble away again."
bubble,before,formal,2019-12-06T06:30:34Z,"When the little green speech bubble first showed up in my life, I greeted it with awe and wonder."
bubble,before,formal,2019-12-06T05:00:32Z,“They’re in their Westminster bubble.
bubble,before,formal,2019-12-05T12:58:34Z,"Instead she saw “a lot of content that is quite exaggerated or deliberately presented to influence you in a way that’s not connected to the full picture.” Regardless of their place on the political spectrum, the analysts found people are drifting into the same habits, sometimes knowingly embracing the “indulgence” of a reassuring social media bubble of news that reinforced their existing viewpoints in a troubled world."
bubble,before,formal,2019-12-05T12:28:43Z,But this was an unsustainable bubble; one that built a new social order that condemned the next generation to insecurity and stagnating living standards.
bubble,before,formal,2019-12-05T11:00:11Z,"In the Red corner: the guy who’d been chancellor during the Blair years, overseeing a strategy of funding growth by overleveraging an asset bubble, and building detention camps while ramping up officially sanctioned Islamophobia."
bubble,before,formal,2019-12-05T07:36:33Z,Morrison says Albanese has spent his political career focussed on the “bubble of this place” and the “tawdry drama of Canberra”.
bubble,before,formal,2019-12-04T18:20:11Z,"Hendin’s cartoon, riffing on a popular meme by KC Green, shows Johnson sitting in a chair, with fire all around him, and a speech bubble with the words: “This is fine.” He is watching Bettel on TV gesticulating at an empty podium as the press conference goes ahead without him."
bubble,before,formal,2019-12-04T15:59:00Z,"“We are not in an isolated bubble,” says Cammock."
bubble,before,formal,2019-12-04T13:34:14Z,"After Unai Emery was sacked, I found myself arranging my condiments on the kitchen table, cutting a speech bubble out of the back of an envelope, finding some Sellotape and sticking it to the salad cream with the phrase “Arsenal talking to Allegri”, just so I could tweet: “This is what my sauces are saying about the next Arsenal boss.” The worst part of that is I was quite pleased with it."
bubble,before,formal,2019-12-04T13:32:45Z,"Public concern over climate change seems to bubble up every five to 10 years or so, with increasing levels of intensity, and has done since the 1950s."
bubble,before,formal,2019-12-04T13:32:45Z,"It’s vital that we keep this bubble going not just all the way until the Glasgow talks, but afterwards too."
bubble,before,formal,2019-12-04T07:38:35Z,"If you can leave the Canberra bubble with your marriage stronger, a family you are truly proud of, and completely at peace with yourself, then that to me is the ultimate measure of success."
bubble,before,formal,2019-12-03T07:17:19Z,"dismissing them as just gossip or just in the bubble, don’t want to be accountable."
bubble,before,formal,2019-12-03T06:00:14Z,"Part of the explanation came from an effect of social media, identified by the internet activist Eli Pariser in 2011 as the “filter bubble”: an effect of endless personalisation, which, he said, “moves us very quickly toward a world in which the internet is showing us what it thinks we want to see, but not necessarily what we need to see.” We were not aware of it at the time, but doing vox pops had become a way of bursting our bubbles."
bubble,before,formal,2019-12-03T06:00:14Z,"Second, we had been guilty of creating our own filter bubble, by relying too much on a particular type of voter found in a particular place."
bubble,before,formal,2019-12-01T11:00:02Z,"“Is this the arse or the elbow?” went a Private Eye speech bubble, coming from a visitor trying to enter an opening in the arm of a giant figure that was in a “zone” based on the human body."
bubble,before,formal,2019-12-01T06:00:02Z,"Come friends, and slip gently with me into the restaurant equivalent of the bubble bath you never quite want to leave."
bubble,before,formal,2019-12-01T00:23:10Z,"It’s a massive business that is transforming our cities, with student accommodation driving much of the high-rise apartment boom, and noodle and bubble tea shops springing up in the streets around university campuses."
bubble,before,formal,2019-11-30T10:00:33Z,"In the glare of a real national election, one taking place outside the Westminster bubble, will Johnson prove to be the winner the Tories and establishment assume he is?"
bubble,before,formal,2019-11-30T07:00:30Z,"Stir gently, being careful as the caramel will bubble up a little, then quickly pour the caramel evenly on to the tray."
bubble,before,formal,2019-11-29T08:38:37Z,The cardboard boxes were packed and the photograph of the Queen is in bubble wrap.
bubble,before,formal,2019-11-28T09:30:34Z,"As well as playing up, he shows off – there is a brilliant musicality to his Ren and Stimpy vision of sex on French!, for instance: “I guess I got to stretch it out like it was flubber / And leave it dripping green and red like double cheeseburgers / Chewing on cum like bubble gum from Hubba / This bitch knew dick like Bubba knew shrimp”."
bubble,before,formal,2019-11-28T07:28:54Z,"Scrutiny from the media, scrutiny from the public, where when asked questions he says it is just gossip or it is just in the bubble."
bubble,before,formal,2019-11-27T12:00:08Z,"Heat on low, until just starting to bubble (don’t boil!)."
bubble,before,formal,2019-11-26T19:25:09Z,"That’s the terrifying thing about this election: for every normal person in your little bubble who is going to vote along the same lines as you, there’s a possibly fictional, possibly real Nicola Murder–Bulldog out there, quietly writing blood letters on the train, creeping around Birmingham eyeing up the next non-believer to bounce bodily into a canal."
bubble,before,formal,2019-11-26T09:00:17Z,"But I think we are entering a period of backlash against this isolation and being in your own bubble.” Muggs’s book Bass, Mids, Tops sidesteps obvious figures, instead celebrating continuity – from production great Dennis Bovell to underrated Bristol breakbeat duo Smith &amp; Mighty."
bubble,before,formal,2019-11-26T07:01:52Z,To try to distract with a thought bubble.
bubble,before,formal,2019-11-26T07:01:52Z,A thought bubble which I put to you has not been to the cabinet of Australia.
bubble,before,formal,2019-11-25T12:00:51Z,"“I booked loads of tours and two hotel rooms.” While he didn’t want to be presumptuous, he says he packed some chocolates and bubble bath “just in case”."
bubble,before,formal,2019-11-25T11:05:03Z,"Apparently, it contains smoked pulled turkey, stuffing and a cranberry coleslaw, but all I could focus on was the huge slab of bubble and squeak that takes up half the bun."
bubble,before,formal,2019-11-24T18:40:46Z,"In his narcissistic bubble, his reflection – and Matt Hancock – fall about laughing at his comedic and improv genius."
bubble,before,formal,2019-11-24T06:36:45Z,"The 34-year-old returned to his impervious bubble: defending and leaving with surety, before picking off the loose ball whenever England’s heavy-legged bowlers erred in line or length."
bubble,before,formal,2019-11-23T17:00:01Z,"Nearby you can see a drawing by a Soviet design student that, as early as 1928, proposed a car-like, bubble-shaped living pod of a kind that is still a popular version of what the future will look like."
bubble,before,formal,2019-11-23T14:52:58Z,The derby atmosphere continues to bubble away.
bubble,before,formal,2019-11-23T13:00:01Z,"This was always a delicate bubble and it finally began to burst last year, when the Advertising Standards Authority decreed that influencers need to spell it out when they’re being paid to promote something."
bubble,before,formal,2019-11-21T08:28:22Z,"Here, movements bubble up from a down-tempo, meditative intro into a tightly swung solo from Washington before dropping to a half-time ascension and a choral close."
bubble,before,formal,2019-11-20T14:59:08Z,The right-hand side of the chart shows the growth in house prices across the euro area – another tell-tale sign of a growing bubble.
bubble,before,formal,2019-11-20T09:00:23Z,"“As if he were a bubble of air himself, ready at any moment to float into the sky and vanish into the firmament.” The extremity of the climate is an existential force within the book, serving to dwarf and muffle human interactions."
bubble,before,formal,2019-11-19T16:17:18Z,"“Republicans won’t budge unless we have a photo of Trump on the phone with a word bubble coming out of his mouth saying ‘I am doing a crime now,’” he said."
bubble,before,formal,2019-11-19T11:00:01Z,"“You need to have friendships, hobbies and interests outside your relationship.” Beware the love bubble – it always bursts, whether you like it or not."
bubble,before,formal,2019-11-19T07:00:08Z,"The quirkiness, the witticisms, the reload-baiting one-liners, the slightly abrasive edge – all the things that gave grime enough fizz to bubble out of the streets of east London into the palace (Wiley’s MBE), the ballot box (#Grime4Corbyn), the Glastonbury mainstage (Stormzy), and now, it would seem, the TV screens of middle England."
bubble,before,formal,2019-11-18T18:10:24Z,"“They’ve invested a lot of money to make sure the venue, facilities, transport, food, the practice courts, even the bubble courts, everything is very high quality."
bubble,before,formal,2019-11-18T14:39:45Z,"At the General Motors Heritage Center, a great hangar full of gleaming vintage specimens on the outskirts of Detroit, we find the Firebird, a 1950s concept car that looks like a missile on wheels, with a bubble-topped cockpit bulging from its curving fuselage."
bubble,before,formal,2019-11-17T17:00:11Z,"“There’s a layer to it that’s annoying, in that often people – in our smug media bubble but also in the wider community – only know about things like, say, the alt-right, because people went out and spoke to the alt-right and wrote about it … It’s a bit rich to pretend that [alt-right] knowledge somehow just floated into their head from nowhere,” he says tartly."
