target_word,when,type,date,sentence
bubble,before,formal,2019-09-29T14:52:36Z,"Today, the promise of the bubble years has dissipated entirely, and most people are growing accustomed to the fact that their lot is not going to improve."
bubble,before,formal,2019-09-29T09:05:43Z,"They bought “for a pittance” a dilapidated Victorian building that had been a B&amp;B and set about remodelling it; a decade later it is almost complete, all airy, cool and restrained, with a few hidden artworks built in ($25 and €30 coins from the future glued to the floor, a bubble-less spirit level embedded in the stairs)."
bubble,before,formal,2019-09-28T17:32:55Z,"Is the Mums Tipple bubble burst, since he beat just one rival?"
bubble,before,formal,2019-09-28T10:00:09Z,"Finn Lough has catered suites, cottages, lodges and transparent bubble domes, a spa with a lakeside hot tub and sauna, a tennis court and a restaurant serving fish from the lough and the nearby Donegal coast."
bubble,before,formal,2019-09-27T11:00:36Z,"Bring to a simmer, then turn the heat down and let them bubble away for 40 minutes."
bubble,before,formal,2019-09-27T10:02:29Z,"“We were a bubble species long before the internet,” he tells Catherine Shoard in a rare interview."
bubble,before,formal,2019-09-27T08:00:29Z,"But the way he has been used has been ham-fisted and amateur – a quick screen here, a bubble pass there."
bubble,during,formal,2021-12-31T20:05:32Z,This is despite the Nikkei finishing at its highest point since 1989 – just before its bubble burst – in Thursday’s session.
bubble,during,formal,2021-12-31T19:00:28Z,"In a déjà vu piece of Covid-19 intimate bubble casting, Harvey’s blogger character Celina enlists a man, Alab Delusa, played by Harvey’s partner in real life, Matthew Hardie, to help perform the 44 sex acts, ranging from bondage and discipline to orgy participation."
bubble,during,formal,2021-12-31T16:17:43Z,"“At the outer extreme, stocks that wouldn’t have looked out of place in the tech bubble of 2000/2001 are 60% lower on average than earlier in the year,” points out David Miller, the Quilter Cheviot investment director."
bubble,during,formal,2021-12-31T15:27:06Z,"It is still about 25% below its record peak 32 years ago, before the Japanese stock market bubble burst."
bubble,during,formal,2021-12-31T15:00:23Z,"“No matter what’s going on in my life, the minute I arrive at Neighbours I’m back in my bubble.” Neighbours only took a month off production in 2020 due to Covid and was one of the first shows to resume filming with a new Covid safety plan."
bubble,during,formal,2021-12-31T06:23:28Z,"“So it’s kind of like that bubble concept that we had a long time ago.” NSW health authorities, are also working to contain the outbreak of Covid in aged care facilities."
bubble,during,formal,2021-12-30T16:50:11Z,"After a small dip today, it closed at 28,791.71 points, the best finish to a year since 1989, late in Japan’s stock market bubble."
bubble,during,formal,2021-12-30T06:33:44Z,“We have all cast members in a bubble in company accommodation in Adelaide and Sydney so they are not staying with family or friends.
bubble,during,formal,2021-12-29T16:30:26Z,"“Now we are down to the micro-bubble of immediate family,” he said."
bubble,during,formal,2021-12-28T11:45:51Z,"I thought that the recent release of Sony’s PlayStation VR, Oculus’s Gear VR and Google’s Daydream all pointed to an imminent mainstreaming of the technology – or, at least, a definitive answer as to whether or not VR had what it took to break out of the early adopter bubble."
bubble,during,formal,2021-12-27T22:10:41Z,"The developments further underline the precarious nature of a series that involved tense negotiations over the bubble and has already led to Australia’s captain, Pat Cummins, being forced to isolate and miss the second Test in Adelaide because of close contact with a positive case at a restaurant."
bubble,during,formal,2021-12-27T09:28:28Z,"Voters have moved on from Brexit and are now more focused on electing MPs away from the “cheese and wine” Westminster bubble, the new MP for North Shropshire has said after her historic byelection victory."
bubble,during,formal,2021-12-27T09:28:28Z,"“The electorate has moved on and it seems to me that they recognise that voting for a Liberal Democrat who’s very rooted in community politics, who is focused on listening, is a massive contrast to this Westminster Conservative bubble where they go to cheese and wine parties after work,” Morgan said."
bubble,during,formal,2021-12-27T08:00:45Z,"“We are potentially witnessing the end of the valuation bubble in emerging startups, hyper-growth and companies wearing tech clothing, and it would not be a shock to see more pain going into 2022,” he said."
bubble,during,formal,2021-12-26T07:59:05Z,Having to eat their own bodyweight in bubble and squeak.
bubble,during,formal,2021-12-24T09:00:20Z,"The bubble still shockingly includes Seattle, Atlanta and Washington in the NFC."
bubble,during,formal,2021-12-23T16:30:01Z,"Prof Sarah Palmer, a virologist with the Westmead Institute, emphasised the importance of creating a “vaccine bubble” at gatherings, in an effort to protect people from infection."
bubble,during,formal,2021-12-23T08:05:15Z,"Palmer’s application to the Barcaldine regional council was seen by conservationists as an attempt to sidestep consultation on the plan, which Miles himself had suggested could be a “thought bubble.” Miles said this afternoon: “Barcaldine regional council has never assessed a project of this size."
bubble,during,formal,2021-12-22T03:16:56Z,"“I’d be lying if I said there wasn’t a concern [but] people who’ve bought tickets will want to come to this event.” Players’ interactions with fans will remain limited in Melbourne and they will be kept away from crowded indoor spaces, but Cricket Australia is resisting placing them in a hard bubble."
bubble,during,formal,2021-12-21T18:34:07Z,"“But there may still be benefits in slowing the peak, in terms of flattening the curve.” One solution that appears to be on the table is a return to the “step 2” measures introduced as part of the roadmap out of lockdown earlier this year – chiefly, people only being allowed to socialise indoors with members of their household or a support bubble, and outdoor socialising being limited to groups of six people or two households, including at pubs and restaurants."
bubble,during,formal,2021-12-21T06:00:04Z,"“But there may still be benefits in slowing the peak, in terms of flattening the curve.” One solution that appears to be on the table is a return to the “step 2” measures introduced as part of the roadmap out of lockdown earlier this year – chiefly, people only being allowed to socialise indoors with members of their household or a support bubble, and outdoor socialising being limited to groups of six people or two households, including at pubs and restaurants."
bubble,during,formal,2021-12-20T21:06:15Z,"People were only allowed to socialise indoors with members of their own household or support bubble, while outdoor socialising was limited to the rule of six or two households."
bubble,during,formal,2021-12-20T18:53:58Z,"In the Premier League Wolves’ first-team bubble are fully vaccinated and Morecambe of League One are 100% double-jabbed and set to follow Bristol City – whose manager, Nigel Pearson, has suffered with Covid – by receiving their boosters on Tuesday."
bubble,during,formal,2021-12-20T10:13:02Z,"But with anger continuing to bubble in Rennes and frustration at Spurs, attempts to reschedule the game before the Uefa cut-off date of 31 December became deadlocked."
bubble,during,formal,2021-12-19T15:31:24Z,Cummins is expected to return for the third Test although players on both sides are due to be subjected to a more stringent bubble for the next two fixtures because of the rising number of cases in Victoria and New South Wales.
bubble,during,formal,2021-12-19T06:00:18Z,"“But in the end we didn’t think that was practical.” (Not least because Davey had contracted Covid so could not be there.) Eventually, they plumbed for a big blue balloon, daubed with the phrase “Boris’ bubble”, which Morgan popped on camera."
bubble,during,formal,2021-12-18T07:00:51Z,"Oxtail stew, pigs’ trotters with prawn, and doormat-sized T-bone steaks share the billing with trinxat (a Catalan take on bubble and squeak) and a tray of snails just as they should be: not bland, not rubbery, just the right amount of garlic."
bubble,during,formal,2021-12-18T07:00:51Z,"Surrounded by pine forests, the lake is actually a sunken cave fed by thermal springs that bubble up at about 21C."
bubble,during,formal,2021-12-17T19:07:38Z,"PA reports that after Morgan used a yellow pin to pop a large blue balloon which had “Boris’ Bubble” emblazoned on the side, Farron said: I don’t know if you realise how many millions of people have woken up this morning feeling a bit of light has broken into the darkness."
bubble,during,formal,2021-12-17T10:21:48Z,"Despite attempts by ministers to write off allegations over alleged breaches of Covid rules in Downing Street last year as a Westminster bubble story, it became a live issue on the ground."
bubble,during,formal,2021-12-16T12:54:50Z,"In 2020, the Queen and Philip spent Christmas Day together at Windsor without the rest of the family, having spent most of that year being cared for by a reduced number of staff in what was called HMS Bubble."
bubble,during,formal,2021-12-14T06:31:23Z,* * * Blocked pipe causes gas bubble – Gas prices across the UK and Europe are on course to return to record highs after Germany said the controversial Nord Stream 2 pipeline from Russia could not be approved amid deepening tensions on the Ukrainian border.
bubble,during,formal,2021-12-14T06:00:40Z,"A personal view: after everything that’s happened, including but in no way limited to the prime minister’s own bogus “childcare bubble” last Christmas, I find it extremely unlikely that anyone will be asked or expected to celebrate on their own in 2021."
bubble,during,formal,2021-12-14T02:21:51Z,"Bubble, physical and social distancing, a-symptomatic, level 4 to 1 lockdowns, Click and collect, Novel coronavirus shortened to Covid or the virus became topics of many conversations and are still continuing as we negotiate through a global pandemic."
bubble,during,formal,2021-12-14T01:19:05Z,“West Australians have lived a normal life inside our Covid-free bubble and nearly 2 million people have done the right thing and gotten vaccinated.
bubble,during,formal,2021-12-13T18:55:03Z,Bubble fatigue was cited by numerous players as a key reason for England’s dismal fifth-place finish earlier this year.
bubble,during,formal,2021-12-13T08:04:33Z,"McGowan said: Even though Western Australians have lived a normal life inside our Covid free bubble, nearly 2 million people have done the right thing and gotten vaccinated."
bubble,during,formal,2021-12-13T07:09:44Z,“West Australians have lived a normal life inside our Covid-free bubble and nearly 2 million people have done the right thing and gotten vaccinated.
bubble,during,formal,2021-12-12T14:15:28Z,"I think prices will go up another 30% before the bubble bursts,” he said."
bubble,during,formal,2021-12-11T19:00:19Z,"There is a Wellington bubble, but it’s far more humble and down to earth than its Canberra equivalent."
bubble,during,formal,2021-12-10T11:00:38Z,My bubble household – a couple who had been planning to spend the evening having a romantic dinner – invited me over at the last minute.
bubble,during,formal,2021-12-10T02:02:46Z,“We’ll be managing the traffic flows and at quiet times we’ll be completing up to 100% compliance.” Wildman said that border bubble residents could download an “XV pass” – once the system goes live – to assist officers to identify which vehicles should be intercepted.
bubble,during,formal,2021-12-10T00:41:19Z,"He writes: The question facing British politics today is whether the image of a Downing Street Christmas party, and the excruciating insensitivity there would be in holding it on a day when nearly 500 people were dying of Covid, may be the event to burst Johnson’s bubble."
bubble,during,formal,2021-12-10T00:41:19Z,Read more here: Martin Kettle – Will the furore over the No 10 party be enough to burst Boris Johnson’s bubble?
bubble,during,formal,2021-12-09T08:00:06Z,"The question facing British politics today is whether the image of a Downing Street Christmas party, and the excruciating insensitivity there would be in holding it on a day when nearly 500 people were dying of Covid, may be the event to burst Johnson’s bubble."
bubble,during,formal,2021-12-09T00:41:33Z,"However, you know a story has crossed out of the “Westminster bubble” when Ant and Dec are doing skits about it on I’m A Celebrity."
bubble,during,formal,2021-12-08T19:21:11Z,He alleged there had been “other flat parties” and suggested the pair’s “bubble” policy should be investigated.
bubble,during,formal,2021-12-08T19:21:11Z,"The prime minister’s “bubble” has come under scrutiny before, after his spokesperson did not deny that a close friend of Carrie Johnson – Nimco Ali – stayed with them last Christmas."
bubble,during,formal,2021-12-08T19:21:11Z,One of the explanations offered was that Ali was considered part of the Johnsons’ childcare support bubble.
bubble,during,formal,2021-12-08T15:12:36Z,"“Will the CABSEC [Case] also be asked to investigate the *flat* party on Fri 13 Nov, the other flat parties, &amp; the flat’s ‘bubble’ policy … ?” he tweeted."
bubble,during,formal,2021-12-08T14:41:36Z,It was already clear on Tuesday evening that the story had changed from a Westminster bubble” issue to one that had cut through as soon as it featured in a segment from Ant and Dec on ITV’s I’m a Celebrity … last night.
bubble,during,formal,2021-12-08T12:07:15Z,"Just hours before the Downing Street party, he told the public: “If you are forming a Christmas bubble, it’s vital that from today you minimise contact with people from outside your household.” Two days earlier, London had been put into tier 3, which meant that “a work Christmas lunch or party” was prohibited “where that is a primarily social activity”."
bubble,during,formal,2021-12-08T00:05:14Z,London is moved into tier 3 – at the time the toughest coronavirus restrictions – meaning the only permitted indoor social mixing outside your own household was with a support bubble.
bubble,during,formal,2021-12-07T16:08:52Z,"Or perhaps nicking West Ham’s on-pitch bubble machine, setting it to volume 11 and lining the player’s tunnel with a soothing layer of micro-bubbles to avoid unpleasant skin grazing incidents?"
bubble,during,formal,2021-12-07T06:28:19Z,"An attempt at a travel bubble with New Zealand earlier this year, which saw tourists briefly return to the Cook Islands, was halted just weeks later after New Zealand began reporting cases of Delta."
bubble,during,formal,2021-12-07T06:00:19Z,"“I keep thinking,” Terry says, through choked sobs, “that if I’d been aware, we’d have stayed in our bubble."
bubble,during,formal,2021-12-07T06:00:19Z,"Even now, it is only strongly advised in communal areas, and the bubble system has been scrapped."
bubble,during,formal,2021-12-06T08:00:17Z,"It makes sense that investors are looking for the next big thing from tech, and that social media bosses would be searching for ways to profit from the cryptocurrency bubble."
bubble,during,formal,2021-12-06T08:00:17Z,"Since at least 2017, when a bitcoin was trading at less than $1,000 (£750), there have been a glut of articles explaining why the bitcoin bubble is unsustainable."
bubble,during,formal,2021-12-06T08:00:17Z,"If we underestimate the economic value of belief, we will underestimate how large the bubble can grow."
bubble,during,formal,2021-12-06T07:49:08Z,"There is currently a hot spot declared that will be out of the border bubble, and we will address that if there are any changes."
bubble,during,formal,2021-12-06T06:31:16Z,But has the bubble burst in the 21st century?
bubble,during,formal,2021-12-03T23:54:24Z,"The building housing Hermien and Imani, a mother and daughter aged 41 and 14, has been closed to the public and their keepers have formed an isolated social bubble."
bubble,during,formal,2021-12-03T17:45:15Z,"At the time, London was under tier 3 restrictions – the top level – meaning the only permitted indoor social mixing outside your own household was with a support bubble."
bubble,during,formal,2021-12-03T17:45:15Z,"While many people were working or staying at home, only meeting those in their support bubble indoors, it seems that not everyone was following the rules."
bubble,during,formal,2021-12-02T18:02:50Z,"Labour has dug out a tweet that was posted by Boris Johnson on 18 December last year, the day of the second party at No 10 exposed by the Daily Mirror, saying people planning to form a Christmas bubble should minimise contact with others."
bubble,during,formal,2021-12-02T18:02:50Z,“We weren’t seeing anyone else outside of work and were our own bubble.
bubble,during,formal,2021-12-02T07:38:11Z,"And while the Labor party want to focus on the parliamentary games of Canberra and what goes on in the bubble of this place, Mr Speaker, my government, our government, will focus very firmly on what is happening in the homes and the communities all around this country."
bubble,during,formal,2021-12-01T19:49:51Z,"At the time of the 18 December party, London was under the top level of Covid restrictions – tier 3 – meaning the only permitted indoor social mixing outside your own household was with a support bubble."
bubble,during,formal,2021-12-01T18:40:31Z,A Westminster bubble.
bubble,during,formal,2021-12-01T09:34:56Z,Both sets of players have grown weary of bubble life and it is understood the Australian team have already told Cricket Australia they would push back against any further restrictions.
bubble,during,formal,2021-11-30T08:29:10Z,"Karen Andrews is also at this press conference, where she speaks about the decision to delay the border reopening for skilled worker visa holders and international students (as well as the travel bubble with South Korea and Japan)."
bubble,during,formal,2021-11-29T12:20:27Z,"I went to the hospital, had all the tests you can imagine, got a 100% clean bill of health and they were happy for me to go back in.” By leaving the camp, Madeley broke the Covid “bubble” and therefore had to leave the castle."
bubble,during,formal,2021-11-29T07:38:23Z,"We’ve applied those rules to those coming under bubble arrangements, travel bubbles."
bubble,during,formal,2021-11-28T09:00:22Z,"Discounts site Wethrift advises people sending abroad to use secure packaging, including bubble wrap and heavy cardboard boxes, as they will be passing through, at the very least, conveyor belts in two transport depots."
bubble,during,formal,2021-11-27T21:03:40Z,"After the shambles of last year too when some of the Barbarians broke the bubble it is unforgivable,” the former Wales fly-half told the Telegraph."
bubble,during,formal,2021-11-27T19:00:06Z,"“The lack of surety surrounding the border bubble has made it difficult to plan ahead, and although I’m glad we are able to travel back from January, I’ve missed my window."
bubble,during,formal,2021-11-27T11:23:58Z,"The safety of both our celebrities and our production crew remains our primary concern.” Richard Madeley, a contestant on the show, left on Thursday after being taken to hospital, breaking the Covid bubble in place."
bubble,during,formal,2021-11-27T06:16:50Z,"The Aviation Ministry said 14 countries designated by the Health Ministry as ‘at risk’, and with whom there is an existing ‘air bubble’ agreement, would be allowed to resume 75% of pre-Covid operations (or a minimum of seven flights per week)."
bubble,during,formal,2021-11-26T06:00:21Z,"But it’s wild doing them, because we’re in a bubble: we’re playing to 2,000, 3,000 people, but after the gig, we go straight to the hotel, where we’re not allowed to see anyone except room service."
bubble,during,formal,2021-11-26T06:00:21Z,"You get the connection of everyone at the shows going absolutely wild, all this energy thrown at you, then you’re just sat in a bubble afterwards, five of you."
bubble,during,formal,2021-11-26T06:00:20Z,"And if you tighten into that situation, a bubble, it will burst."
bubble,during,formal,2021-11-26T01:07:24Z,Anti-Coalition bias is the theme of complaints about budget coverage and the Inside the Canberra Bubble episode of Four Corners.
bubble,during,formal,2021-11-25T15:38:33Z,because he “broke the Covid ‘bubble’” after he was taken to hospital in the early hours of Thursday.
bubble,during,formal,2021-11-25T15:38:33Z,"“By leaving the camp, I had consequently broken the Covid ‘bubble’ and as such I’ve had to leave the castle and all the wonderful celebs that remain in the camp."
bubble,during,formal,2021-11-25T15:12:55Z,"It was a Covid-restricted set, with contestants living in a bubble and many going long stretches without seeing their families, so it is no wonder that they became close."
bubble,during,formal,2021-11-25T13:11:16Z,Brassmonky It does affect you to have grown up in a country that was like a bubble in the world in terms of having better social security and healthcare than anywhere else.
bubble,during,formal,2021-11-23T11:46:16Z,"“Whether it be a full-school production or a virtual or ‘bubble-friendly’ approach, the angel wings and wonky crowns still shine through."
bubble,during,formal,2021-11-22T20:01:05Z,"From 1 December, the travel bubble will be expanded and skilled workers, eligible visa holders and international students will be able to arrive quarantine-free, subject to some conditions."
bubble,during,formal,2021-11-22T07:54:28Z,"In addition to the introduction of the travel bubble from Singapore, which only started on the 21st, from the 1 December 2021 Australia will also welcome back fully vaccinated citizens from Japan and Korea."
bubble,during,formal,2021-11-22T07:54:28Z,"It comes after Australia welcomed tourists from Singapore on Sunday, following the start of a quarantine-free travel bubble between the two nations."
bubble,during,formal,2021-11-22T04:15:59Z,"From 1 December, Australia’s travel bubble will be expanded and skilled workers, eligible visa holders and international students will be able to arrive quarantine-free, subject to some conditions."
bubble,during,formal,2021-11-22T04:15:59Z,We are all working together on what is a very challenging issue.” Are there any changes to the travel bubble?
bubble,during,formal,2021-11-22T04:15:59Z,"The travel bubble has been operating since 1 November, when one-way quarantine-free travel resumed from New Zealand to Australia."
bubble,during,formal,2021-11-22T04:15:20Z,"A travel bubble operating for Singapore will also extend to Japan and South Korea, allowing quarantine-free travel for these citizens, including tourists, subject to a negative Covid test before departure."
bubble,during,formal,2021-11-21T06:33:29Z,The contingent has arrived on flights touching down in Sydney and Melbourne from Singapore as part of the two-way travel bubble between the two countries.
bubble,during,formal,2021-11-20T07:00:23Z,"As we travel, the world outside our solemn bubble carries on relentlessly cheerfully."
bubble,during,formal,2021-11-19T08:50:26Z,"Here’s a Friday thought bubble: Financial markets and the weather are often treated very separately, and yet they are inextricably linked."
bubble,during,formal,2021-11-18T08:31:23Z,It’s the first travel bubble since a similar corridor ended with our mates across the ditch.
bubble,during,formal,2021-11-18T00:23:53Z,"No spectators from outside China will be allowed to attend the Olympics, which will be held from 4 February in a “closed-loop” bubble."
bubble,during,formal,2021-11-17T19:58:15Z,"He said: The government believes that it is an historic strength of our system that MPs should have a wider focus than the Westminster bubble, that we should maintain connections to the world beyond so that we may draw on the insight and expertise that this experience offers, and that rather than a chamber replete with professional politicians with no previous career or future career other than to remain on the public payroll, we have a parliament that benefits from MPs with a broader range of talents and professional backgrounds."
bubble,during,formal,2021-11-15T04:29:32Z,"This tool also allows for adding a second circle, to see the travel bubble overlap where you and another person are able to exercise together where applicable lockdown restrictions exist."
bubble,during,formal,2021-11-13T19:00:13Z,"“In this area, we were in a nice bubble so it didn’t seem incredibly pressing,” she says."
bubble,during,formal,2021-11-13T11:00:03Z,"Everyone’s in their bubble, their echo chamber, whether it’s social media or the news they watch."
bubble,during,formal,2021-11-13T00:04:52Z,Athletes and other Games-related personnel will also be enveloped in a “closed loop” bubble.
bubble,during,formal,2021-11-07T12:00:01Z,"Stepping out of my middle-class bubble, I began to understand how and why people do what they do."
bubble,during,formal,2021-11-05T17:54:26Z,"When I wake up in the morning and come here I’m in this bubble 10, 12, 14 hours."
bubble,during,formal,2021-11-05T08:39:17Z,"Overnight, Moree was removed from our border bubble."
bubble,during,formal,2021-11-05T06:15:51Z,"As China Evergrande faces another do-or-die debt deadline next week, Xi Jinping is piloting a local property tax that he hopes can deflate China’s massive housing bubble."
